Usando datetime, escribí un programa que imprica cuántos dias faltan para el 1 de enero del proximo año.;;;from datetime import datetime|hoy = datetime.now()|primero_proximo_ano = datetime(hoy.year + 1, 1, 1)|dias_faltantes = (primero_proximo_ano - hoy).days|print(f"Faltan {dias_faltantes} días para el 1 de enero del próximo año.")
Escribí una función crear_backup(nombre) que reciba un nombre de archivo y lo copie con sufijo _backup. Usar os y shutil.;;;import os|import shutil|def crear_backup(nombre):|    nuevo_nombre = nombre + '_backup'|    shutil.copy(nombre, nuevo_nombre)|    return nuevo_nombre
Simulá la creación de un entorno virtual y la instalacion del paquete cowsay. Incluí creacion, activación, instalación y exportación de requerimientos;;;python3 -m venv entorno|source entorno/bin/activate|.\entorno\Scripts\activate|pip install cowsay|pip freeze > requirements.txt
Implementá una función que reciba un string y retorne la longitud de la última palabra;;;def longitud_ultima_palabra(texto):|    return len(texto.strip().split()[-1])|print(longitud_ultima_palabra("Hola mundo de Python"))
Usando *args, escribí una funcion que devuela el mayor de todos los valores ingresados;;;def max_args(*args):|    return max(args)|print(max_args(5, 10, 3, 42, 7))
Escribí una funcion que reciba un numero de DNI y retorne true si tiene 7 u 8 digitos validos, false si no;;;def verificar_dni(dni):|    return len(str(dni)) in [7, 8]|print(verificar_dni(12345678))  # True|print(verificar_dni(12345))     # False